{
  "$schema": "https://json-schema.org/draft/2020-12/schema",
  "$id": "platform/cursor-plugin.schema.json",
  "title": "Cursor plugin manifest (.cursor-plugin/plugin.json) as generated by this repository",
  "description": "Maintained here. Modeled on the manifests published in github.com/microsoft/skills (.github/plugins/*/.cursor-plugin/plugin.json, checked 2026-10-14) and on https://cursor.com/docs/reference/plugins (mcpServers as a file path or inline config; Cursor expands ${CURSOR_PLUGIN_ROOT} and not the standard's ${PLUGIN_ROOT}; checked 2026-10-22). End-to-end install in Cursor has not been verified by this repository yet.",
  "type": "object",
  "required": ["name", "description", "version", "skills"],
  "additionalProperties": false,
  "properties": {
    "name": { "type": "string", "pattern": "^[a-z0-9]+(-[a-z0-9]+)*$" },
    "description": { "type": "string" },
    "version": { "type": "string" },
    "author": { "type": "object" },
    "homepage": { "type": "string" },
    "repository": { "type": "string" },
    "license": { "type": "string" },
    "keywords": { "type": "array", "items": { "type": "string" } },
    "skills": { "const": "./skills/" },
    "agents": { "const": "./agents/" },
    "mcpServers": {
      "oneOf": [
        { "const": "./.mcp.json" },
        {
          "type": "object",
          "description": "Inline server configs keyed by name, used when a server needs Cursor's own plugin-root variable. Cursor infers the transport from command or url.",
          "propertyNames": { "pattern": "^[a-z0-9]+(-[a-z0-9]+)*$" },
          "additionalProperties": {
            "type": "object",
            "additionalProperties": false,
            "properties": {
              "command": { "type": "string", "minLength": 1 },
              "args": { "type": "array", "items": { "type": "string" } },
              "env": { "type": "object", "additionalProperties": { "type": "string" } },
              "cwd": { "type": "string" },
              "url": { "type": "string", "pattern": "^https://" },
              "headers": { "type": "object", "additionalProperties": { "type": "string" } }
            },
            "oneOf": [{ "required": ["command"] }, { "required": ["url"] }]
          }
        }
      ]
    }
  }
}
