{
  "name": "sap-abap",
  "description": "Skills for SAP ABAP development across customer-managed and cloud systems: Standard ABAP on SAP ECC 6.0, SAP NetWeaver AS ABAP, and SAP S/4HANA (on premises or on Azure, AWS, or Google Cloud VMs), enhancements and integration, plus ABAP Cloud with RAP and clean core assessments.",
  "version": "0.2.0",
  "author": {
    "name": "Enterprise Agent Skills contributors",
    "url": "https://github.com/enterprise-agent-skills/enterprise-agent-skills"
  },
  "homepage": "https://github.com/enterprise-agent-skills/enterprise-agent-skills/tree/main/plugins/sap-abap",
  "repository": "https://github.com/enterprise-agent-skills/enterprise-agent-skills",
  "license": "MIT",
  "keywords": [
    "sap",
    "abap",
    "ecc",
    "netweaver",
    "s4hana",
    "abap-cloud",
    "rap",
    "enhancements",
    "idoc",
    "odata",
    "clean-core"
  ],
  "skills": "./skills/",
  "agents": "./agents/"
}
